{"aud":"urn:kodex:internal-rpc-authority:manifest-root","jwk_thumbprint_sha256":"b33a5dc52ea1a1693d545139fbb129504210a1d17f1be021419da99dad56cca8","kid":"ira-manifest-root-g1","not_after":2101856198,"not_before":1786495898,"purpose":"AUTHORITY_SNAPSHOT_MANIFEST_ROOT","root_generation":1,"root_id":"internal-rpc-authority-manifest-root-v1","source_digest_sha256":"90c7fd4955d938ece2a21e531d688dbe734721c174f79fa1bdbeb254702cd349","source_revision":1,"v":1}